{
 "meta": {
  "schema": "optiondesk/strategy_comparison/v1",
  "generated_utc": "2026-09-08T22:15:38+00:00",
  "tool": "optiondesk compare",
  "shell_version": "0.3.0",
  "engine_version": "0.3.0",
  "provider_used": "user snapshot",
  "degraded": false,
  "degraded_reason": null,
  "notes": [
   "Synthetic teaching inputs. No observed quotes, holdings, or price history. Not market-performance evidence.",
   "row 1: calculated mid from bid and ask",
   "row 2: calculated mid from bid and ask",
   "row 3: calculated mid from bid and ask",
   "row 4: calculated mid from bid and ask",
   "row 5: calculated mid from bid and ask",
   "row 6: calculated mid from bid and ask",
   "row 7: calculated mid from bid and ask",
   "row 8: calculated mid from bid and ask",
   "row 9: calculated mid from bid and ask",
   "row 10: calculated mid from bid and ask",
   "row 11: calculated mid from bid and ask",
   "row 12: calculated mid from bid and ask",
   "row 13: calculated mid from bid and ask",
   "row 14: calculated mid from bid and ask",
   "row 15: calculated mid from bid and ask",
   "row 16: calculated mid from bid and ask",
   "row 17: calculated mid from bid and ask",
   "row 18: calculated mid from bid and ask",
   "row 19: calculated mid from bid and ask",
   "row 20: calculated mid from bid and ask",
   "row 21: calculated mid from bid and ask",
   "row 22: calculated mid from bid and ask",
   "row 23: calculated mid from bid and ask",
   "row 24: calculated mid from bid and ask",
   "row 25: calculated mid from bid and ask",
   "row 26: calculated mid from bid and ask",
   "row 27: calculated mid from bid and ask",
   "row 28: calculated mid from bid and ask",
   "row 29: calculated mid from bid and ask",
   "row 30: calculated mid from bid and ask",
   "row 31: calculated mid from bid and ask",
   "row 32: calculated mid from bid and ask",
   "row 33: calculated mid from bid and ask",
   "row 34: calculated mid from bid and ask",
   "row 35: calculated mid from bid and ask",
   "row 36: calculated mid from bid and ask",
   "row 37: calculated mid from bid and ask",
   "row 38: calculated mid from bid and ask",
   "row 39: calculated mid from bid and ask",
   "row 40: calculated mid from bid and ask",
   "row 41: calculated mid from bid and ask",
   "row 42: calculated mid from bid and ask",
   "row 43: calculated mid from bid and ask",
   "row 44: calculated mid from bid and ask",
   "row 45: calculated mid from bid and ask",
   "row 46: calculated mid from bid and ask",
   "row 47: calculated mid from bid and ask",
   "row 48: calculated mid from bid and ask",
   "row 49: calculated mid from bid and ask",
   "row 50: calculated mid from bid and ask",
   "row 51: calculated mid from bid and ask",
   "row 52: calculated mid from bid and ask",
   "row 53: calculated mid from bid and ask",
   "row 54: calculated mid from bid and ask",
   "row 55: calculated mid from bid and ask",
   "row 56: calculated mid from bid and ask",
   "row 57: calculated mid from bid and ask",
   "row 58: calculated mid from bid and ask",
   "row 59: calculated mid from bid and ask",
   "row 60: calculated mid from bid and ask",
   "row 61: calculated mid from bid and ask",
   "row 62: calculated mid from bid and ask",
   "covered_call not compared: requires holding the underlying; pass --include-underlying",
   "protective_put not compared: requires holding the underlying; pass --include-underlying"
  ],
  "inputs": {
   "snapshot": "examples/dashboard/chain_SYNTH_2026-10-08.json",
   "size": 1.0
  },
  "disclaimer": "Research output, not investment advice, and not a recommendation or solicitation. Option premiums here are theoretical model values, not quotes and not achievable fills. Market data is third-party, may be delayed or wrong, and its redistribution is governed by the provider's terms. No warranty. See DISCLAIMER.md.",
  "license": "Produced by optiondesk under the PolyForm Noncommercial License 1.0.0. Noncommercial use is permitted; commercial use requires a separate written agreement with the copyright holder. See LICENSE and LICENSES.md."
 },
 "underlying": "SYNTH",
 "expiry": "2026-10-08",
 "spot": 100.0,
 "criterion": "model expected profit divided by capital at risk, ties broken by model probability of profit",
 "caveat": "Ranked by model expected profit per unit of capital at risk, under a lognormal settlement model at a single at-the-money volatility. The market prices each strike with its own volatility, so a positive expectation here largely measures that disagreement rather than an edge. Premiums are mid quotes, not fills. This is an ordering of structures under stated assumptions, not a recommendation to trade any of them.",
 "rankable_count": 18,
 "excluded_count": 3,
 "margin_over_runner_up": 0.034012217198205935,
 "leader": {
  "strategy": "bear_put_spread",
  "trade_type": "debit",
  "net_cash": -1.9920349999999998,
  "max_gain": 4.007965,
  "max_loss": -1.9920349999999998,
  "capital_at_risk": 1.9920349999999998,
  "reward_risk": 2.0119952711674247,
  "breakevens": [
   98.007965
  ],
  "probability_of_profit": 0.40800776634388713,
  "probability_of_loss": 0.591992233656113,
  "expected_pnl": 0.15774106013413958,
  "expected_loss": -1.8124339766015325,
  "expected_return_on_risk": 0.07918588786549413,
  "net_delta": -0.2793457972084883,
  "net_theta": -0.011601788861636868,
  "net_vega": 3.566661451103,
  "net_gamma": 0.018081677778995713,
  "friction_verdict": "ok",
  "friction_cost": 0.11096900000000015,
  "rankable": true,
  "excluded_because": [],
  "rank": 1
 },
 "rows": [
  {
   "strategy": "bear_call_spread",
   "trade_type": "credit",
   "net_cash": 0.38717100000000004,
   "max_gain": 0.38717100000000004,
   "max_loss": -3.612829,
   "capital_at_risk": 3.612829,
   "reward_risk": 0.10716560346476404,
   "breakevens": [
    108.387171
   ],
   "probability_of_profit": 0.8681656840408425,
   "probability_of_loss": 0.13183431595915757,
   "expected_pnl": 0.0015376222639163772,
   "expected_loss": -2.522646796501008,
   "expected_return_on_risk": 0.0004256006204324581,
   "net_delta": -0.09495090532720643,
   "net_theta": 0.0149749355301853,
   "net_vega": -3.3682485143240783,
   "net_gamma": -0.01615311463092845,
   "friction_verdict": "ok",
   "friction_cost": 0.022924,
   "rankable": true,
   "excluded_because": [],
   "rank": 10
  },
  {
   "strategy": "bear_put_spread",
   "trade_type": "debit",
   "net_cash": -1.9920349999999998,
   "max_gain": 4.007965,
   "max_loss": -1.9920349999999998,
   "capital_at_risk": 1.9920349999999998,
   "reward_risk": 2.0119952711674247,
   "breakevens": [
    98.007965
   ],
   "probability_of_profit": 0.40800776634388713,
   "probability_of_loss": 0.591992233656113,
   "expected_pnl": 0.15774106013413958,
   "expected_loss": -1.8124339766015325,
   "expected_return_on_risk": 0.07918588786549413,
   "net_delta": -0.2793457972084883,
   "net_theta": -0.011601788861636868,
   "net_vega": 3.566661451103,
   "net_gamma": 0.018081677778995713,
   "friction_verdict": "ok",
   "friction_cost": 0.11096900000000015,
   "rankable": true,
   "excluded_because": [],
   "rank": 1
  },
  {
   "strategy": "broken_wing_butterfly",
   "trade_type": "credit",
   "net_cash": 0.044514999999999194,
   "max_gain": 4.044514999999999,
   "max_loss": -3.955485000000001,
   "capital_at_risk": 3.955485000000001,
   "reward_risk": 1.0225079857463744,
   "breakevens": [
    104.044515
   ],
   "probability_of_profit": 0.7153840768107376,
   "probability_of_loss": 0.28461592318926243,
   "expected_pnl": 0.04427110263784628,
   "expected_loss": -2.894024426110514,
   "expected_return_on_risk": 0.011192332327855187,
   "net_delta": -0.17060124476943125,
   "net_theta": 0.029070319088909412,
   "net_vega": -6.366700053702774,
   "net_gamma": -0.02962719568315434,
   "friction_verdict": "untradeable",
   "friction_cost": 0.36965399999999987,
   "rankable": false,
   "excluded_because": [
    "friction says untradeable: round trip is 830.4 percent of the premium, above the 25 percent limit"
   ]
  },
  {
   "strategy": "bull_call_spread",
   "trade_type": "debit",
   "net_cash": -2.153148,
   "max_gain": 3.846852,
   "max_loss": -2.153148,
   "capital_at_risk": 2.153148,
   "reward_risk": 1.7866175478880228,
   "breakevens": [
    102.153148
   ],
   "probability_of_profit": 0.3733236601245393,
   "probability_of_loss": 0.6266763398754607,
   "expected_pnl": -0.13235525849905294,
   "expected_loss": -1.9633929323836927,
   "expected_return_on_risk": -0.061470580981452715,
   "net_delta": 0.296764518411606,
   "net_theta": -0.014940036466431994,
   "net_vega": 2.679682597348478,
   "net_gamma": 0.011287532231755652,
   "friction_verdict": "ok",
   "friction_cost": 0.12089999999999995,
   "rankable": true,
   "excluded_because": [],
   "rank": 18
  },
  {
   "strategy": "bull_put_spread",
   "trade_type": "credit",
   "net_cash": 0.350402,
   "max_gain": 0.350402,
   "max_loss": -3.6495979999999997,
   "capital_at_risk": 3.6495979999999997,
   "reward_risk": 0.09601112232086932,
   "breakevens": [
    91.649598
   ],
   "probability_of_profit": 0.871297227574275,
   "probability_of_loss": 0.12870277242572503,
   "expected_pnl": 0.0010290318581454017,
   "expected_loss": -2.3492364348220756,
   "expected_return_on_risk": 0.00028195759043746785,
   "net_delta": 0.07907049715780698,
   "net_theta": 0.012955934428726178,
   "net_vega": -3.079744966050095,
   "net_gamma": -0.01406982421458808,
   "friction_verdict": "ok",
   "friction_cost": 0.02095600000000003,
   "rankable": true,
   "excluded_because": [],
   "rank": 11
  },
  {
   "strategy": "calendar_put_spread",
   "trade_type": "debit",
   "net_cash": -1.0997880000000002,
   "max_gain": 1.745714195394111,
   "max_loss": -1.3787204683748016,
   "capital_at_risk": 1.3787204683748016,
   "reward_risk": 1.2661842885758503,
   "breakevens": [
    95.8088,
    105.0521
   ],
   "probability_of_profit": 0.4618885120642688,